id,word,definition,forms,example,uses,img_prompt
167,similar,"When two or more things have many things in common, they are alike.",similarity,My sister and I have similar tastes in music.,"similar to, look similar, quite similar",Two identical red apples placed side by side on a white surface.
168,solve,To find an answer to a problem or a question.,"solved, solving, solver, solution",I need to solve this math problem before class.,"solve a problem, solve a mystery, solve a puzzle","A person happily placing the last piece of a jigsaw puzzle, completing the picture."
169,source,"The place, person, or thing where something comes from or starts.","sources, sourced, sourcing",The internet is a great source of information.,"reliable source, primary source, source code, source of income","A clear spring of water bubbling up from the ground, representing the origin of a river."
170,specific,Clearly defined or identified. Particular and exact.,"specifically, specificity",The scientist gave specific instructions for the experiment.,"specific example, specific details, specific purpose",A magnifying glass focusing on one particular flower in a field of blurred flowers.
171,spread,"To open, arrange, or place something so that it covers a larger area.","spreading, spreadable",I spread the blanket on the grass for our picnic.,"spread butter, spread rumors, spread out",A hand using a knife to spread jam on a slice of bread.
172,state,The condition that something is in at a specific time. It can also refer to a region or area within a country.,"states, stated, stating",The car is in good state after the repair. California is a state in the United States.,"state of mind, state government, state park",A map highlighting the state of California within the United States.
173,store,A place where you can buy things.,"stores, stored, storing",I went to the store to buy some milk.,"grocery store, department store, store hours, in store",A brightly lit grocery store aisle filled with various products on shelves.
174,strengthen,To make something stronger or more effective.,"strengthens, strengthened, strengthening",Regular exercise can strengthen your muscles.,"strengthen relationship, strengthen economy, strengthen security","A weightlifter lifting heavy weights, symbolizing the act of making muscles stronger."
175,stress,A feeling of worry or pressure caused by difficult situations.,"stressed, stressing",Too much work can cause stress.,"cause stress, relieve stress, under stress","A person with their hands on their head, looking overwhelmed by a pile of paperwork."
176,strike,To hit or attack someone or something forcefully.,"strikes, struck, striking",The baseball player will strike the ball with the bat.,"go on strike, strike a match, strike a deal",A lightning bolt striking a tall tree during a thunderstorm.
177,structure,"The way that something is built, arranged, or organized.","structural, restructure",The structure of the building is very strong.,"building structure, organizational structure, social structure",A simple diagram showing the framework of a building with clearly defined beams and columns.
178,submit,"To give something to someone in authority, like a teacher or boss, so they can consider it or deal with it.","submission, submitted, submitting",Please submit your homework by Friday.,"submit a report, submit an application, submit to authority",A student handing a stack of papers to a teacher at a desk.
179,adapt,To change and get used to a new situation or environment.,"adaptation, adaptable, adapted, adapting",It takes time to adapt to a new school.,"adapt to change, adapt easily, adapt quickly, adapt yourself",A chameleon changing its color to match the leaf it's sitting on.
180,adequate,Enough or satisfactory for a particular purpose.,"adequately, adequacy","The food was adequate, but not great.","adequate supply, adequate resources, adequate training",A person holding a glass of water that is filled just enough to quench their thirst.
181,advantage,A condition or situation that puts you in a favorable position.,"advantages, advantageous",Having a good education can give you an advantage when applying for jobs.,"take advantage of, competitive advantage, unfair advantage","A runner ahead of the other runners in a race, clearly in the lead."
182,afford,To have enough money to buy something.,"affordable, affordability",I can't afford a new car right now.,"afford to buy, afford the cost, can't afford","A person looking sadly at a new car in a showroom, with an empty wallet in their hand."
183,alternative,Something you can choose instead of something else.,alternatively,"If the bus is late, the alternative is to take a taxi.","alternative energy, alternative medicine, alternative solution","A road splitting into two paths, one labeled 'Original Plan' and the other 'Alternative'."
184,analyse,To examine something carefully in order to understand it.,"analysis, analyses, analysing, analysed",The scientist will analyse the data to find new information.,"analyse data, analyse results, analyse information, analyse a situation","A person looking at a graph with a magnifying glass, carefully examining the data."
185,apparent,Easy to see or understand.,apparently,It was apparent that she was tired because she kept yawning.,"apparent reason, apparent success, become apparent","A light bulb suddenly turning on above a person's head, indicating a clear understanding."
186,appropriate,Suitable or right for a particular situation or person.,"appropriately, appropriateness",It's not appropriate to wear jeans to a wedding.,"appropriate behavior, appropriate clothing, appropriate language","A person choosing a suitable outfit from a wardrobe."
187,aspect,A part or feature of something. It's one way of looking at it.,aspects,The most important aspect of the job is teamwork.,"important aspect, different aspect, positive aspect","A multifaceted crystal, each facet reflecting a different scene or image, symbolizing different aspects."
188,attitude,"The way you think and feel about something, which shows in your behavior.",attitudinal,"She has a positive attitude towards her work, always smiling and ready to help.","positive attitude, negative attitude, bad attitude, show attitude, change attitude","A person with a big smile, giving a thumbs up."
189,aware,Knowing or realizing something; understanding a situation or fact.,"awareness, unaware",I wasn't aware that she had changed her hair.,"aware of, become aware, fully aware",A person with wide open eyes looking at a bright lightbulb suddenly appearing above their head.
190,brief,Short in time; using few words.,"briefly, brevity","The meeting was brief, only lasting 30 minutes.","brief overview, brief summary, brief encounter, in brief","A stopwatch showing only a few seconds left, with a hand quickly writing on a notepad."
191,capable,Having the ability or skill to do something well.,"capability, capably",She is a very capable student and always gets good grades.,"capable of, highly capable, capable leader","A person successfully completing a challenging task, like solving a complex puzzle or fixing a machine, with a look of confidence and competence."
192,category,A group of things that are similar or related to each other in some way.,"categories, categorize, categorization",Fruits like apples and bananas belong to the category of healthy foods.,"broad category, different categories, main category","A shelf divided into sections with labels like 'Fruits', 'Vegetables', and 'Dairy', each containing relevant items."
193,circumstance,The conditions or facts that affect a situation.,circumstances,"Due to the difficult circumstances, they had to postpone the trip.","difficult circumstances, under the circumstances, changing circumstances","A winding road with a fork; one path is sunny and clear, the other is dark and stormy, illustrating different possible situations."
194,commit,To promise or decide to do something with dedication.,"commitment, committed, committing",I commit to exercising three times a week.,"commit a crime, commit suicide, commit to a relationship, commit resources",A person signing a contract with a determined expression.
195,complex,Something that is difficult to understand or deal with because it has many different parts.,complexity,The instructions were too complex for me to follow.,"complex problem, complex system, complex issue",A tangled ball of colorful yarn with many interwoven strands.
196,conscious,Aware of what is happening around you; knowing that you exist and are able to think.,"consciousness, consciously",She was conscious that someone was watching her.,"conscious decision, conscious effort, conscious of","A person lying in bed, eyes open, a thought bubble above their head showing a lightbulb."
197,constant,Something that stays the same and doesn't change.,constantly,The speed of light is a constant.,"constant speed, constant temperature, constant effort","A graph showing a straight horizontal line, indicating a value that does not change over time."
198,consume,"To use something up, like food, energy, or time.","consumed, consuming, consumption",The car consumes a lot of gasoline.,"consume energy, consume food, consume time","A car at a gas station, with the gas pump showing a high number of gallons being pumped."
199,contemporary,Existing or happening now.,,Contemporary art is very popular these days.,"contemporary music, contemporary design, contemporary society","A modern building with sleek lines and large glass windows, showcasing contemporary architecture."
200,contract,A written or spoken agreement that is intended to be enforceable by law.,"contracts, contracted, contracting",They signed a contract to rent the apartment for one year.,"sign a contract, breach of contract, contract negotiations",Two hands shaking over a signed document with a pen resting on top.
201,convenient,Easy to use or suitable for your needs; not causing difficulties.,"convenience, inconvenient",The bus stop is very convenient because it's close to my house.,"convenient location, convenient time, convenient way",A person happily using a smartphone to quickly order a coffee while walking down the street.
202,crucial,Extremely important or necessary; something that has a big impact on the result.,crucially,It is crucial to wear a helmet when riding a bicycle.,"crucial role, crucial decision, crucial factor","A large gear in a machine, clearly vital to the machine's operation, highlighted in bright color."
203,currency,The money that is used in a particular country or area.,currencies,The currency of Japan is the Yen.,"foreign currency, local currency, exchange currency","A stack of different colorful banknotes and coins from various countries, clearly showing different symbols and denominations."
204,decade,A period of ten years.,,The band was popular for a decade.,"past decade, next decade, decade of the 1980s","A calendar page showing years from 2020 to 2029, clearly marked as 'One Decade'."
205,deny,To say that something is not true or to refuse to admit that you did something.,"denies, denying, denied, denial","He denied stealing the money, even though everyone saw him do it.","deny a claim, deny responsibility, deny access, deny a request","A person shaking their head with a big 'X' over their face, symbolizing refusal."
206,despite,"Even though something might stop you, you still do it.",none,"Despite the rain, we went for a walk.","despite everything, despite the fact that, despite his efforts","A person smiling and walking forward with determination, holding an umbrella in heavy rain."
207,dimension,"A measurement of something in a particular direction, like length, width, or height. It can also refer to a part or aspect of something.",dimensional,The box has dimensions of 10cm x 20cm x 5cm. Considering the emotional dimension of the problem is important.,"three-dimensional, fourth dimension, spatial dimension, add a new dimension","A cube with labeled sides showing length, width, and height."
208,diverse,Including many different types of people or things.,"diversity, diversify",The school has a diverse group of students from many countries.,"diverse range, culturally diverse, diverse opinions","A group of people with different skin colors, hair styles, and clothing, standing together smiling."
209,draft,A preliminary version of a piece of writing.,"drafts, drafted, drafting",I need to write a first draft of my essay tonight.,"first draft, rough draft, draft proposal","A hand writing on a piece of paper, with several crumpled papers around it, suggesting it's a draft."
210,dramatic,Full of emotion and excitement; like a scene from a play or movie.,"dramatically, drama","She made a dramatic entrance at the party, wearing a long red dress.","dramatic change, dramatic effect, dramatic increase","A person standing on a stage with a spotlight shining on them, making a grand and emotional gesture."
211,dynamic,Something that is constantly changing or active. It has a lot of energy and is always moving or progressing.,dynamically,"The city is a dynamic place, full of life and activity.","dynamic environment, dynamic personality, dynamic economy","A group of diverse people running and jumping forward, symbolizing progress and energy in a vibrant city landscape."
212,emerge,To come out of something or somewhere; to become known or apparent.,"emerged, emerging, emergence",The sun began to emerge from behind the clouds.,"emerge from, emerge as, newly emerged",A small seedling emerging from the soil in a garden.
213,emphasis,Special importance or attention that is given to something.,"emphasize, emphasized, emphasizing",The teacher put emphasis on the importance of doing homework.,"place emphasis, strong emphasis, emphasize the importance",A hand pointing strongly at a word highlighted in bright yellow on a page of text.
214,encounter,"To meet someone unexpectedly or to experience something, often a problem or difficulty.","encounters, encountered, encountering",I encountered an old friend at the grocery store.,"encounter a problem, encounter resistance, first encounter","Two people bumping into each other on a busy street, looking surprised."
215,ensure,To make sure that something will happen.,"ensured, ensuring",Please ensure that all doors are locked before leaving.,"ensure safety, ensure quality, ensure compliance","A hand turning a key in a lock, symbolizing the act of making something secure and guaranteed."
216,entitle,To give someone the right to have or do something.,"entitlement, entitled",Having a ticket doesn't entitle you to a better seat.,"entitle to, feel entitled, legally entitled",A person holding a golden key that unlocks a door labeled 'Privileges'.
217,estimate,"To make a guess about the size, cost, or amount of something.","estimation, estimated",I estimate it will take about two hours to finish the project.,"estimate cost, rough estimate, accurate estimate","A person holding a calculator and looking at a house blueprint, calculating the building cost."
218,evident,Easy to see and understand; obvious.,"evidence, evidently",It was evident that she was happy because she was smiling.,"evident fact, evident truth, become evident","A magnifying glass focusing on a footprint in the sand, making it very clear."
219,exploit,"To use someone or something in a way that is unfair or selfish, often for your own benefit.","exploitation, exploitable",The company was exploiting its workers by making them work long hours for very little pay.,"exploit resources, exploit a situation, exploit workers","A large factory with smokestacks towering over tiny, overworked figures."
220,expose,"To show something that was hidden, or to make something known.","exposure, exposed, exposing",The sun can expose your skin to harmful rays.,"expose a secret, expose a problem, expose someone to danger","A curtain being pulled back to reveal a bright, sunny landscape."
221,extract,"To remove or take something out, often by force or with effort.","extraction, extractor",They extract juice from oranges.,"extract information, extract a tooth, extract resources",A close-up of a hand using a tool to pull a bright red strawberry from a leafy green plant.
222,factor,Something that affects a situation or decision. It's a reason or cause that contributes to a result.,factors,The weather was a major factor in our decision to cancel the picnic.,"key factor, important factor, contributing factor, risk factor",A set of scales with a large weight labeled 'Weather' tipping the balance against smaller weights representing other considerations.
223,flexible,"Able to bend easily without breaking; also, able to change or adapt to new situations.",flexibility,"The yoga instructor was very flexible. Our plans are flexible, so we can change them if needed.","flexible schedule, flexible material, flexible approach","A person doing a yoga pose, bending their body into a flexible position."
224,identical,Exactly the same; alike in every way.,"identity, identically",The two cars are identical in color and model.,"identical twins, identical copies, virtually identical",Two identical red apples sitting side-by-side on a table.
225,impact,A strong effect or influence on something or someone.,"impactful, impacted, impacting",The new law will have a big impact on the environment.,"major impact, significant impact, positive impact, negative impact, impact assessment","A large ball hitting a wall, creating a visible crack."
226,initial,Coming at the beginning; first.,"initially, initiate",My initial reaction was surprise.,"initial impression, initial stage, initial investment","A large letter 'I' at the beginning of a sentence, much bigger than the other letters."
227,input,Information or data that is put into a computer or a system.,"inputs, inputted, inputting",Please input your password to log in.,"input data, input device, input method","A keyboard with a hand typing on it, with the word 'INPUT' appearing on the screen."
228,instance,A particular example or single occurrence of something.,instances,This website is a good instance of how technology can help people.,"for instance, in this instance, clear instance",A single red apple standing out among a group of green apples.
229,institute,"An organization or place devoted to a specific purpose, especially research or education.","institution, institutional",The research institute is dedicated to finding a cure for cancer.,"research institute, educational institute, institute a policy, institute proceedings",A grand building with columns and a sign that reads 'Institute of Scientific Research'.
230,label,A piece of paper or other material that is attached to something and gives information about it.,"labels, labeled, labeling",The label on the bottle tells you what's inside.,"product label, price label, clothing label, to label something",A close-up of a jar with a handwritten label tied to it with twine.
231,layer,"A single thickness of a material or substance, spread out or covering a surface.","layered, layering",The cake had three layers of sponge with cream in between.,"layer of paint, layer of clothing, layer of security",A slice of a colorful layered cake showing distinct layers of different colors.
232,lecture,A talk or speech given to a group of people to teach them about a particular subject.,"lectures, lecturing, lectured",The professor gave a fascinating lecture on the history of science.,"attend a lecture, give a lecture, lecture hall, guest lecture","A professor standing at a podium in a lecture hall, speaking to students who are taking notes."
233,legal,Allowed by law; something that follows the rules of a country or area.,"legally, legality",It is legal to drive at 16 in some countries.,"legal advice, legal action, legal document","A gavel hitting a sound block in a courtroom, symbolizing law and justice."
234,manual,"Done or operated by hand. Also, a book that gives instructions about how to use something.",manually,"The car has a manual transmission, so you need to use the clutch.","manual labor, instruction manual, manual control","A person's hands using a wrench to tighten a bolt, illustrating work done by hand."
235,mature,Fully grown or developed. When a person acts responsibly like an adult.,maturity,She is very mature for her age. The apples are mature and ready to pick.,"mature cheddar, mature audience, mature tree, mature behavior","A tree with ripe, red apples hanging from its branches, ready to be harvested."
236,network,"A group of things that are connected and work together. It can be people, computers, or roads.","networking, networked",I use a computer network to share files with my colleagues.,"social network, computer network, road network","A simple illustration showing several computers connected to each other with lines, representing a computer network."
237,nevertheless,Despite something that has just been mentioned. It means 'in spite of that' or 'however'.,,"It was raining; nevertheless, we went for a walk.","nevertheless, I believe; nevertheless, it is important; nevertheless, the study showed","A person holding an umbrella in the rain, but smiling and walking forward confidently."
238,obvious,Easy to see or understand; clear.,obviously,It's obvious that he is tired because he keeps yawning.,"obvious choice, obvious mistake, obvious sign","A lightbulb brightly illuminated above a person's head, symbolizing a clear and obvious idea."
239,overall,Including or considering everything; in general.,,"Overall, I think it was a good meeting.","overall impression, overall cost, overall effect","A bird's-eye view of a cityscape, showing all the buildings and streets together."
240,passive,"If someone is passive, they don't actively do things or show their feelings. They let things happen to them.","passively, passivity",He was too passive and didn't stand up for himself.,"passive role, passive income, passive resistance","A person sitting on a bench while opportunities and events pass them by, without them reacting or participating."
241,period,"A length of time; an amount of time. Also, the punctuation mark (.) at the end of a sentence.",periods,The school day is divided into several periods. / Put a period at the end of the sentence.,"time period, menstrual period, period of history, end of period","A calendar page showing a marked block of time, with a large red circle around it. / A large period punctuation mark at the end of a sentence."
242,phase,A stage in a process or in the development of something.,phases,The project is in its final phase.,"a phase of life, a testing phase, go through a phase","A series of images showing a caterpillar transforming into a butterfly, illustrating different phases of development."
243,philosophy,"The study of fundamental questions about existence, knowledge, values, reason, mind, and language.","philosophies, philosophical, philosopher",She studied philosophy at university to understand the meaning of life.,"moral philosophy, political philosophy, philosophy of science, personal philosophy","An old man with a long beard sitting under a tree, deeply thinking with a book in his lap."
244,policy,"A set of rules or a plan that is used as a guide for making decisions, especially in a government, business, or organization.",policies,The company has a strict policy against using social media during work hours.,"company policy, government policy, insurance policy, foreign policy","A document labeled 'Policy' with a gavel resting on top, symbolizing rules and decisions."
245,portion,"A part or share of something, like food or money, that is given to someone or that belongs to them.",portions,He ate a large portion of pizza.,"generous portion, small portion, equal portions, portion control","A plate with a clearly defined slice of cake, representing a single serving or portion."
246,potential,The possibility that something can develop or happen in the future.,potentially,This student has a lot of potential to become a great scientist.,"potential benefits, potential risks, potential customer","A small seedling growing out of the earth, with sunlight shining on it, symbolizing future growth."
247,precise,Very accurate and exact; not general.,"precisely, precision",The scientist took precise measurements of the chemical reaction.,"precise details, precise instructions, precise timing",A close-up of a ruler measuring a line with extreme accuracy.
248,previous,Happening or existing before the one you are talking about.,previously,"I had a previous appointment, so I couldn't meet you earlier.","previous experience, previous owner, previous year",A calendar page being turned back to the month before the current one.
249,primary,Most important; main.,primarily,My primary goal is to finish my studies.,"primary school, primary care, primary color","A large, highlighted '1' to represent 'primary' as the first or most important."
250,priority,Something that is most important and needs attention before anything else.,priorities,My priority is to finish my homework before I watch TV.,"high priority, top priority, set priorities",A to-do list with the first item clearly marked as 'Priority #1' with a star.
251,prohibit,"To officially stop something from being done, used, or allowed.","prohibition, prohibited, prohibiting",The school prohibits students from using their phones during class.,"prohibit smoking, strictly prohibit, prohibit access","A large red stop sign placed over a cigarette, clearly indicating that smoking is not allowed."
252,range,A set of numbers or values that have a lowest and highest limit.,ranges,The price of the product is in the range of $10 to $20.,"wide range, age range, price range",A number line showing values from 10 to 20 highlighted within a bracket.
