id,word,definition,forms,example,uses,img_prompt
253,recover,"To get back to a normal state of health, mind, or strength after being sick, injured, or troubled.","recovery, recoverable",It took her a few weeks to recover from the flu.,"recover from, fully recover, quick recovery, economic recovery","A person in bed gradually sitting up, looking healthier and more energetic each day, symbolizing recovery from illness."
254,region,"A region is a specific area or part of a country, the world, or a town.",regional,The southern region of Italy is famous for its beaches.,"region of the country, region of the world, coastal region, mountainous region",A map highlighting a specific area with a distinct color to represent a region.
255,relevant,Connected with or important to what is happening or being discussed.,,Her experience is relevant to the job.,"relevant information, highly relevant, directly relevant, relevant experience",A magnifying glass focusing on a document labeled 'Important Information' among many scattered papers.
256,formulate,"To create or prepare something carefully, like a plan or a recipe. It means to develop something in a clear and detailed way.",formulation,The scientists had to formulate a new hypothesis after their experiment failed.,"formulate a plan, formulate a strategy, formulate a recipe",A person carefully writing a detailed plan with steps and arrows on a whiteboard.
257,role,The part you play or the job you have in a particular situation.,roles,My role in the play is the friendly neighbor.,"play a role, key role, important role","A person wearing different hats, each representing a different job or responsibility."
258,series,A number of similar things that happen or come one after another.,series (plural is also series),I'm watching a series of documentaries about nature.,"TV series, book series, a series of events, winning series","A stack of books, each with a different number indicating its order in the series, such as 'Book 1', 'Book 2', 'Book 3'."
259,strategy,"A plan or method for achieving a specific goal, often involving multiple steps or actions.","strategies, strategic, strategically",Our company's strategy is to increase sales by 20% this year.,"business strategy, marketing strategy, military strategy, long-term strategy","A chess board with pieces arranged in a strategic formation, highlighting the concept of planning and tactics."
260,substitute,To use something or someone instead of another thing or person.,"substitution, substituted, substituting",You can substitute margarine for butter in this recipe.,"substitute teacher, substitute player, substitute ingredient",A chef replacing a stick of butter with a tub of margarine while baking.
261,sufficient,Enough; as much as is needed.,sufficiency,We have sufficient food for the party.,"sufficient funds, sufficient evidence, sufficient time",A hand holding just enough water to fill a glass to the brim.
262,summary,"A short statement that gives the main points of something (like a book, article, or speech).","summarize, summaries, summarizing, summarized",I wrote a summary of the book after I finished reading it.,"executive summary, brief summary, in summary, provide a summary","A notepad with a short paragraph of text titled 'Summary' at the top, with bullet points highlighting key information."
263,accuracy,How correct or exact something is.,"accurate, accurately",The accuracy of the clock is very important for the experiment.,"high accuracy, improve accuracy, test accuracy","A dart hitting the bullseye of a dartboard, symbolizing precision and correctness."
264,ambition,A strong desire to achieve something great or important.,ambitious,Her ambition is to become a successful doctor.,"burning ambition, political ambition, personal ambition",A person climbing a very tall mountain with a flag at the summit.
265,analysis,A careful examination of something to understand it better.,"analyses, analyze, analyzing, analysed",The scientist did an analysis of the water sample to check for pollution.,"data analysis, detailed analysis, in-depth analysis, market analysis","A person looking at a graph with rising lines, using a magnifying glass."
266,application,"A formal request to an authority for something, such as a job, admission to a school, or a loan. It can also be a computer program designed for a specific task.","applications, applicable, apply",She submitted her application for the job online. / I use a weather application on my phone.,"job application, application form, application process, mobile application","A person filling out a job application form with a pen, with a laptop displaying an online application form in the background."
267,background,The area or things behind the main thing you are looking at. It can also mean someone's past experiences or history.,,"I like the flowers in the foreground, but the mountains in the background are beautiful too. Her family background is very interesting.","in the background, background music, family background, historical background","Like a person, and blurred trees and mountains in the background."
268,capacity,"The amount of something that a place can hold, or the ability to do something.",,"The stadium has a capacity of 50,000 people. / She has a great capacity for learning languages.","maximum capacity, holding capacity, capacity to learn, capacity for work","A large stadium filled with cheering fans."
269,commitment,A promise to do something or to behave in a particular way.,commit,She has a strong commitment to her job and always works hard.,"make a commitment, strong commitment, personal commitment, time commitment",A person signing a contract with a determined expression.
270,consequence,Something that happens as a result of an action. It can be good or bad.,"consequences, consequential","If you don't study, the consequence might be a bad grade.","face the consequences, serious consequences, direct consequence","A domino effect, starting with one domino falling and leading to a chain reaction of other dominoes falling."
271,consideration,Careful thought about something before making a decision.,"consider, considerable, considering","After careful consideration, I decided to accept the job offer.","take into consideration, under consideration, give consideration to","A person sitting at a desk, thoughtfully looking at a document with a magnifying glass."
272,content,"The information or ideas that are in a book, movie, website, etc.",contents,The content of the book was very interesting.,"content creator, content marketing, table of contents","A person reading a book with words and pictures floating out of it, representing the information inside."
273,context,"The situation, events, or information that are related to something and that help you understand it.",,"To understand the story, you need to know the context.","in context, out of context, historical context, cultural context","An open book with magnifying glass focusing on a paragraph, surrounded by related historical artifacts and maps."
274,contribution,Something that you give or do to help make something successful.,"contribute, contributor",Her contribution to the project was very important.,"make a contribution, significant contribution, valuable contribution",A group of diverse hands placing puzzle pieces together to complete a picture.
275,criticism,"Expressing disapproval of someone or something, often pointing out faults or mistakes.","criticize, critic, critical",The movie received a lot of criticism from reviewers.,"constructive criticism, face criticism, invite criticism",A person pointing a finger at a document with a disapproving facial expression.
276,definition,"The meaning of a word, phrase, or symbol. It explains what something is or what it means.",definitions,The definition of 'happy' is feeling pleasure or joy.,"clear definition, dictionary definition, precise definition, working definition","An open dictionary with the word 'definition' highlighted, and an arrow pointing to the explanation of the word."
277,delivery,"The act of bringing something (like a package, food, or mail) to a person or place.","deliver, deliveries, delivered, delivering",Our pizza delivery was very fast tonight.,"food delivery, package delivery, on-time delivery, make a delivery",A delivery person in uniform holding a package at a front door.
278,description,A statement that gives details about someone or something. It tells you what they are like.,descriptions,The job description outlined the responsibilities of the role.,"detailed description, physical description, brief description",A person writing notes while carefully observing a detailed drawing of a flower.
279,determination,The quality of trying to do something even when it is difficult.,"determinate, determine, determinedly",Her determination to finish the marathon was inspiring.,"show determination, strong determination, determination to succeed","A person with a determined expression climbing a steep mountain, reaching for the summit."
280,difficulty,When something is hard to do or understand; a problem.,"difficult, difficulties",I had difficulty understanding the instructions.,"have difficulty, face difficulty, overcome difficulty","A person struggling to climb a steep hill, representing a challenge."
281,direction,"The path along which someone or something moves, faces, or lies. It can also be guidance or instructions on how to do something.","directions, directional, directionless",The sign gave us the direction to the museum.,"give direction, change direction, in the direction of, under the direction of",A compass pointing north with a clear arrow indicating the direction.
282,discussion,A conversation about a particular topic where people share their ideas and opinions.,discussions,"After the presentation, we had a long discussion about the project's future.","have a discussion, open discussion, in discussion with, discussion forum","A group of people sitting around a table, talking and gesturing with their hands."
283,effect,A result or consequence of something. It's what happens because of something else.,"effects, effective, effectively",The medicine had a positive effect on her health.,"cause and effect, have an effect, side effect, positive effect, negative effect","A domino effect, with one domino knocking over a line of others."
284,effort,The work or energy you put into doing something.,efforts,He made a big effort to finish the project on time.,"make an effort, put in effort, considerable effort, joint effort",A person sweating while lifting a heavy barbell at the gym.
285,environment,"The surroundings or conditions in which a person, animal, or plant lives or operates.","environmental, environmentally",We should protect the environment from pollution.,"natural environment, work environment, learning environment, protect the environment","A lush green forest with clean air and sunlight filtering through the trees, illustrating a healthy environment."
286,equipment,Tools or machines that you need for a particular activity.,,The gym has a lot of exercise equipment.,"sports equipment, office equipment, safety equipment","A collection of various tools neatly arranged on a workbench, including a hammer, wrench, screwdriver, and pliers."
287,evidence,"Facts, objects, or signs that show that something exists or is true.",evidential,The police found evidence that proved he was at the crime scene.,"scientific evidence, provide evidence, strong evidence, lack of evidence","A magnifying glass over a fingerprint on a document, symbolizing proof."
288,explanation,A statement or account that makes something clear; a reason or justification.,explanations,The teacher gave a clear explanation of the math problem.,"detailed explanation, simple explanation, offer an explanation",A teacher pointing to a whiteboard with a complex equation being broken down into simpler parts with arrows and labels.
289,expression,A look on someone's face that shows their feelings or thoughts.,"expressions, expressive, expressively",The expression on her face showed that she was very surprised.,"facial expression, common expression, to give expression to",A close-up of a person's face with wide eyes and a surprised expression.
290,improvement,When something gets better or when you make something better.,"improve, improves, improved, improving",There has been a big improvement in my English since I started taking classes.,"significant improvement, slight improvement, continuous improvement, room for improvement","A graph showing an upward trending line, indicating progress and positive change."
291,intention,A plan or desire to do something.,"intentional, intentionally",Her intention was to surprise her friend with a party.,"good intention, original intention, express intention",A person pointing an arrow towards a target with a determined look.
292,introduction,The act of presenting someone or something for the first time. It's like saying 'hello' and giving some basic information.,"introductions, introductory",The book has a long introduction that explains what it's about.,"introduction to, brief introduction, formal introduction","A person shaking hands with another person, with a speech bubble above them saying 'Hello, I'm...'."
293,investigation,"A careful search or examination in order to discover facts, especially about a crime or problem.","investigate, investigator, investigating",The police are carrying out an investigation into the robbery.,"conduct an investigation, launch an investigation, thorough investigation, criminal investigation",A detective holding a magnifying glass over a footprint at a crime scene.
294,endure,To experience something difficult or painful for a long time.,"endurance, enduring",The pioneers had to endure many hardships on their journey.,"endure hardship, endure pain, endure suffering, long endure",A lone tree standing strong against a powerful storm.
295,clarify,To make something easier to understand by giving more details or a simpler explanation.,"clarification, clarifies, clarifying",Could you clarify what you mean by that?,"clarify a statement, clarify a situation, clarify the meaning","A light bulb illuminating a question mark, making it clear and easy to see."
296,hesitate,"To pause or be slow in acting, speaking, or deciding because you feel unsure or nervous.","hesitation, hesitatingly",She hesitated before answering the question because she wasn't sure of the correct answer.,"hesitate to do something, hesitate for a moment, without hesitation","A person standing at a crossroads, looking unsure and pausing before choosing a path."
297,imply,To suggest something without saying it directly. It's like hinting at something.,"implies, implied, implying, implication","His tone implied that he was unhappy, even though he didn't say it.","imply a meaning, imply consent, strongly imply","A person winking with a finger pointing to their lips, suggesting a secret."
298,perceive,"To notice or become aware of something using your senses (like sight, hearing, smell, taste, or touch). It means to understand or think of something in a particular way.","perception, perceived, perceiving",I perceive a change in her attitude towards me.,"perceive as, perceive the world, easily perceived","A close-up of an eye looking through a magnifying glass at a small object, symbolizing observation and understanding."
299,manipulate,To control or influence someone or something cleverly or unfairly.,"manipulation, manipulator",He tried to manipulate his friends into doing what he wanted.,"manipulate data, manipulate a situation, emotionally manipulate",A hand using strings to control a puppet.
300,postpone,To decide that something will be done at a later time.,postponement,The meeting was postponed until next week because the manager was sick.,"postpone a meeting, postpone a decision, postpone an event","A calendar with a large red 'X' over today's date, and an arrow pointing to a future date."
